{
  "$schema": "./visual-targets.schema.json",
  "description": "Visual proof targets for Hermes3D OS GUI. Each entry maps a reference PNG from Images-GUI/ to a hash route + tolerance. Targets without a working route are marked status='future' and skipped at runtime by visual-proof.spec.ts.",
  "owner": "claude-w6-6-visual-proof",
  "created": "2026-05-09",
  "tolerance_default": 0.1,
  "viewport": { "width": 1920, "height": 1080 },
  "targets": [
    {
      "target": "01_dashboard_advanced_a",
      "reference": "Images-GUI/01-dashboard-modes/advanced-dashboard-a.png",
      "route": "/#dashboard",
      "status": "live",
      "tolerance": 0.1,
      "wait_test_id": "dashboard-root",
      "notes": "Advanced dashboard mode primary view A. Owned by Wave 6 lane 3 (W6-3 dashboard mode switcher) for parity work."
    },
    {
      "target": "01_dashboard_advanced_b",
      "reference": "Images-GUI/01-dashboard-modes/advanced-dashboard-b.png",
      "route": "/#dashboard",
      "status": "future",
      "tolerance": 0.1,
      "wait_test_id": "dashboard-root",
      "notes": "Advanced dashboard alt view B. Future target — owned by Wave 6 lane 3."
    },
    {
      "target": "01_dashboard_simple_a",
      "reference": "Images-GUI/01-dashboard-modes/simple-dashboard-a.png",
      "route": "/?ui=simple#dashboard",
      "status": "future",
      "tolerance": 0.15,
      "wait_test_id": "dashboard-root",
      "notes": "Simple dashboard mode A. Mode switcher is being added by W6-3."
    },
    {
      "target": "01_dashboard_simple_b",
      "reference": "Images-GUI/01-dashboard-modes/simple-dashboard-b.png",
      "route": "/?ui=simple#dashboard",
      "status": "future",
      "tolerance": 0.15,
      "wait_test_id": "dashboard-root",
      "notes": "Simple dashboard mode B. Future target — owned by Wave 6 lane 3."
    },
    {
      "target": "01_dashboard_custom_a",
      "reference": "Images-GUI/01-dashboard-modes/custom-dashboard-a.png",
      "route": "/#dashboard",
      "status": "future",
      "tolerance": 0.15,
      "wait_test_id": "dashboard-root",
      "notes": "Custom dashboard with draggable widgets — not implemented yet. Future target — owned by Wave 6 lane 3 / 4."
    },
    {
      "target": "01_dashboard_custom_b",
      "reference": "Images-GUI/01-dashboard-modes/custom-dashboard-b.png",
      "route": "/#dashboard",
      "status": "future",
      "tolerance": 0.15,
      "wait_test_id": "dashboard-root",
      "notes": "Custom dashboard alt B. Future target."
    },
    {
      "target": "02_primary_autopilot_design_gen3d_jobs",
      "reference": "Images-GUI/02-primary-pages/primary-tabs-autopilot-design-gen3d-jobs.png",
      "route": "/#autopilot",
      "status": "live",
      "tolerance": 0.12,
      "wait_test_id": "autopilot-root",
      "notes": "Composite reference of 4 primary tabs. Compared against Autopilot first; per-tab specs cover the rest."
    },
    {
      "target": "02_primary_printers_observe_agents_learning",
      "reference": "Images-GUI/02-primary-pages/primary-tabs-printers-observe-agents-learning.png",
      "route": "/#printers",
      "status": "live",
      "tolerance": 0.12,
      "wait_test_id": "printers-root",
      "notes": "Composite reference. Compared against Printers first."
    },
    {
      "target": "02_primary_artifacts_approvals_plugins_roadmap",
      "reference": "Images-GUI/02-primary-pages/primary-tabs-artifacts-approvals-plugins-roadmap.png",
      "route": "/#artifacts",
      "status": "live",
      "tolerance": 0.12,
      "wait_test_id": "artifacts-root",
      "notes": "Composite reference. Compared against Artifacts first."
    },
    {
      "target": "03_settings_subtabs_all",
      "reference": "Images-GUI/03-settings-voice/settings-subtabs-all.png",
      "route": "/#settings",
      "status": "live",
      "tolerance": 0.12,
      "wait_test_id": "settings-root",
      "notes": "All 6 settings subtabs (providers/agents/printers/environment/updates/about)."
    },
    {
      "target": "03_voice_communication_subtabs",
      "reference": "Images-GUI/03-settings-voice/voice-communication-subtabs.png",
      "route": "/#voice",
      "status": "live",
      "tolerance": 0.12,
      "wait_test_id": "voice-root",
      "notes": "Voice subtabs (browser/transcript/proof-review)."
    },
    {
      "target": "04_source_os_60_app_coverage_matrix",
      "reference": "Images-GUI/04-source-os/source-os-60-app-coverage-matrix.png",
      "route": "/#sources",
      "status": "live",
      "tolerance": 0.12,
      "wait_test_id": "source-os-root",
      "notes": "Source OS 60-app coverage matrix view."
    },
    {
      "target": "04_source_os_core_categories",
      "reference": "Images-GUI/04-source-os/source-os-core-categories.png",
      "route": "/#sources",
      "status": "live",
      "tolerance": 0.12,
      "wait_test_id": "source-os-root",
      "notes": "Source OS core categories landing."
    },
    {
      "target": "04_source_os_remaining_categories",
      "reference": "Images-GUI/04-source-os/source-os-remaining-categories.png",
      "route": "/#sources",
      "status": "live",
      "tolerance": 0.12,
      "wait_test_id": "source-os-root",
      "notes": "Source OS remaining categories. Same root, different sub-section reference."
    },
    {
      "target": "05_action_window_core_apps",
      "reference": "Images-GUI/05-action-windows/action-window-core-apps.png",
      "route": "/#dashboard",
      "status": "future",
      "tolerance": 0.2,
      "wait_test_id": "dashboard-root",
      "notes": "Action Window core-apps template. Action Window is being added by W6-4."
    },
    {
      "target": "05_action_window_advanced_tools",
      "reference": "Images-GUI/05-action-windows/action-window-advanced-tools.png",
      "route": "/#dashboard",
      "status": "future",
      "tolerance": 0.2,
      "wait_test_id": "dashboard-root",
      "notes": "Action Window advanced-tools template. Future target — owned by W6-4."
    },
    {
      "target": "06_states_responsive_reference",
      "reference": "Images-GUI/06-states-responsive/states-responsive-reference.png",
      "route": "/#dashboard",
      "status": "future",
      "tolerance": 0.2,
      "wait_test_id": "dashboard-root",
      "notes": "Loading/empty/blocked/recovering responsive states reference. Per-state specs are out of scope for this lane."
    },
    {
      "target": "07_plugins_skills_mcp_app_connectors",
      "reference": "Images-GUI/07-plugins-skills-mcp/plugins-skills-mcp-app-connectors.png",
      "route": "/#plugins",
      "status": "live",
      "tolerance": 0.12,
      "wait_test_id": "plugins-root",
      "notes": "Plugins / Skills / MCP / App Connectors landing."
    },
    {
      "target": "08_workflow_printqueue_files_logs",
      "reference": "Images-GUI/08-app-utility-pages/workflow-printqueue-files-logs.png",
      "route": "/#jobs",
      "status": "future",
      "tolerance": 0.15,
      "wait_test_id": "jobs-root",
      "notes": "Composite of workflow + print queue + files + logs. No single route maps yet; uses Jobs as anchor. Future target — split by lane 3/4."
    },
    {
      "target": "08_proof_health_notifications_safety",
      "reference": "Images-GUI/08-app-utility-pages/proof-health-notifications-safety.png",
      "route": "/#observe",
      "status": "future",
      "tolerance": 0.15,
      "wait_test_id": "observe-root",
      "notes": "Composite of proof + health + notifications + safety. Anchored to Observe. Future target."
    },
    {
      "target": "09_theme_variants_reference",
      "reference": "Images-GUI/09-themes/theme-variants-reference.png",
      "route": "/#dashboard",
      "status": "future",
      "tolerance": 0.25,
      "wait_test_id": "dashboard-root",
      "notes": "Theme palette reference (default/cyberpunk/matrix/tron/forge/aurora). Theme switcher not implemented; future target."
    },
    {
      "target": "00_user_hermes3d",
      "reference": "Images-GUI/00-user-current-downloads/Hermes3D.png",
      "route": "/",
      "status": "live",
      "tolerance": 0.15,
      "wait_test_id": "dashboard-root",
      "notes": "User-approved baseline of the app shell at default route."
    },
    {
      "target": "00_user_generated_1",
      "reference": "Images-GUI/00-user-current-downloads/Generated image 1.png",
      "route": "/#dashboard",
      "status": "future",
      "tolerance": 0.2,
      "wait_test_id": "dashboard-root",
      "notes": "Generated reference 1 — direction PNG, not a 1:1 page snapshot. Skipped from strict comparison; tracked for visual direction only."
    },
    {
      "target": "00_user_generated_2",
      "reference": "Images-GUI/00-user-current-downloads/Generated image 2.png",
      "route": "/#dashboard",
      "status": "future",
      "tolerance": 0.2,
      "wait_test_id": "dashboard-root",
      "notes": "Generated reference 2."
    },
    {
      "target": "00_user_generated_3",
      "reference": "Images-GUI/00-user-current-downloads/Generated image 3.png",
      "route": "/#dashboard",
      "status": "future",
      "tolerance": 0.2,
      "wait_test_id": "dashboard-root",
      "notes": "Generated reference 3."
    },
    {
      "target": "00_user_generated_4",
      "reference": "Images-GUI/00-user-current-downloads/Generated image 4.png",
      "route": "/#dashboard",
      "status": "future",
      "tolerance": 0.2,
      "wait_test_id": "dashboard-root",
      "notes": "Generated reference 4."
    },
    {
      "target": "00_user_generated_5",
      "reference": "Images-GUI/00-user-current-downloads/Generated image 5.png",
      "route": "/#dashboard",
      "status": "future",
      "tolerance": 0.2,
      "wait_test_id": "dashboard-root",
      "notes": "Generated reference 5."
    },
    {
      "target": "00_user_generated_6",
      "reference": "Images-GUI/00-user-current-downloads/Generated image 6.png",
      "route": "/#dashboard",